番号,判定,総プレイ時間(時間),レビュー本文,AI感情判定(Ollama),具体的な要因,要因の分類,AIによる分析理由
86,おすすめ,1439,"タンク　ダメージ　サポート　の三つのロールと書いてありますがこれは嘘です
マッチングでロール確定選択をしない限り、ほぼタンク専になります。

その話はいったん置きまして．．．。
ほぼクイック専の感想ではありますが、このゲームは本当に面白いと思います。
キャラを動かしたときの楽しさ、爽快さ、気持ちの良いプレーができたときの脳汁は他スキル系FPS（ﾓﾊﾞ系FPS）のはるか上をいく気持ちよさがあります。
（私自身、出身FPSはC〇Dで、楽しく突ショットガンで快楽を摂取していた中このゲームを遊び始めたところ、古巣には戻らなくなったくらい、このゲームは本当に面白いです。）
一方、気持ちいいだけかと思いきやチームの構成や動き、スキルを吐くタイミングやポジションを考えて動く重要性もかなり高いので、そういった面でも楽しめるゲームであると私は考えます。

ただし、これはクイック専の私が書いたレビューです。
ランクマッチは「楽しい地獄」とも言われているので、本気よりでランクを上げようと思っている方は注意してください。",positive,気持ちよさ,ゲームシステム,キャラを動かしたときの爽快感や脳汁が他FPSとは比べ物にならないほど気持ち良いと述べているため。
87,おすすめしない,1142,"他責が多いです。
自身は間違っていないという、変な自信を持たれた方が大勢います。
民度のせいで、ゲームが不憫でならない。",negative,他責,その他,プレイヤーの民度を批判し、ゲーム自体に問題があると感じているため。
88,おすすめ,128,"やるだけ無駄


D.vaはいいぞー",negative,ボリューム不足,ボリューム・価格,「やるだけ無駄」と表現しているため。
89,おすすめしない,266,"どういうわけか最近頻繁に試合中にタイトル画面に戻されマッチから外されます。そしてペナルティーを受けてゲームをできなくされます。コレが治らないと最悪アカウントを失うことになりかねないんだけどこれは運営は把握してるんだろうか…
追記
新シーズンになってからさらに悪化しました。毎日1回は起きてる感じでどんどんまともに遊べなくなってきてますね…",negative,マッチング問題,ゲームシステム,頻繁にタイトル画面に戻され、ペナルティを受けるというゲームシステム上の問題点が挙げられているため。
90,おすすめしない,660,"ゲーム内データで約1.000時間遊んでいるプレイヤーです。もしかしたら、やっている人は何処かのマッチで名前を見たかもしれません。
もし、時間と人に対して〇意を膨れ上がらせることをしたくなかったらやらない方が良いです。

同じ実力の者と同じと気軽なカジュアルマッチは相手は強く味方は弱い、または逆のガバガバのマッチングばかりです。

カジュアルはまだ割り切れますがランクマッチは地獄です。

私はシーズン2からSUPから初めて今はタンクをメインにやっています。道中までトロールもトキシックもしませんでしたが真面目に頑張っても味方は何もしない、アンチピックもしないマッチで刺さりもしないOTP達、エイムも判断も立ち回りも終わってるDPSとSUP達のTank Gap GG のチャットが日々、連呼され文句を言うやつは通報してそのランクマッチはキャラ練習や相手チームとエモート遊びをする位に心が壊れました。

更にカジュアルでも実力がガバガバマッチを運営は平等のマッチングだと公言しています。6連敗の後に2勝して4連敗、1勝して4連敗。

もし、本当に公平なお互いの実力が同じのマッチングならプラチナ1かダイヤに届いたかもしれない私のランクはプラチナ3昇格から7段階下がったゴールド5、更にシルバーへの降格保護がついたランクに落ちました。これが運営の言う公平なマッチだというのがタンクのランクマッチの”平等”のマッチングらしいです。

この様に、長々とレビューをくらいに私は鬱憤も限界になり情緒も破壊される程になってしまったので書きました。

OW！辞めよう！

そして、他のゲームをした方が幸せに楽しくなれる！",negative,マッチングの不公平さ,ゲームシステム,運営が公言する平等なマッチングとは程遠く、実力の差が激しいマッチングばかりでプレイヤーはストレスを感じているため。
91,おすすめしない,425,ゴミ,negative,ゴミ,その他,「ゴミ」という表現から、ゲームに対するネガティブな感情が強いことがわかるため。
92,おすすめしない,468,"フルパ(5人)でプレイできないのであれば、おすすめしません。
ソロでプレイするとストレスが溜まるだけです。
ランクシステムがゴミです。
判定でプラチナ以下であれば違うゲームをしましょう。",negative,ランクシステム,ゲームシステム,ランクシステムの評価が低く、プレイ意欲を削ぐため。
93,おすすめしない,338,おもんない,negative,ボリューム不足,ボリューム・価格,「おもんない」という表現から、ゲームの内容に満足していないため。
94,おすすめしない,644,"民度があまりにも終わりすぎている。
他にも民度が低いと称されるゲームは数多くあるが、個人的にはこれまでやってきたゲームの中で断トツで最低。

プレイするなら最低でも設定からチャット表示はオフにすることをお勧めします。
いや、そもそもインストールすること自体お勧めしません。
というか、少しでもこのゲームに興味を持って今ここのレビュー欄を見ていることすらお勧めしません。
ブラウザバックしてもっと他の楽しいゲームを探しましょう。",negative,民度,その他,プレイヤーの行動やコミュニティの質を批判しており、ゲーム自体へのネガティブな印象が強い。
95,おすすめしない,48,"今日抜くキャラを決めてp〇rn hubをつけるだけのゲームです
足の裏見てるほうがおもろい",negative,ボリューム不足,ボリューム・価格,「今日抜くキャラを決めてp〇rn hubをつけるだけのゲーム」と表現し、内容が薄いと感じているため。
96,おすすめしない,334,みんなでアンランクやってるときは非常に楽しかったがソロランクに潜った瞬間世界が変わりました。そこは地獄だと思ってます。子供の時に親に読んでもらった地獄の本に追加してほしいです、無限ow地獄。別のゲームのおかげで治った白髪とはげもまた再発しました,positive,無限ow地獄,ゲームシステム,ソロランクでの過酷な状況を「地獄」と表現し、ホラー要素として肯定的に捉えているため。
97,おすすめしない,901,tank gap gg,negative,ボリューム不足,ボリューム・価格,「tank gap gg」という表現から、ゲームが短く、期待外れだったと感じているため。
98,おすすめしない,97,マッチング長いくせにマッチングシステムが終わっている。勝率を調整するんじゃなくてチームバランスを調整してくれ,negative,マッチングシステム,ゲームシステム,マッチングシステムの不備が原因で不満を抱いているため。
99,おすすめ,1120,"とんでもないストレスと、ドブ川のような品質のプレイヤーたちに人生を少しずつ壊されていくゲームです。
マゾヒズムに傾倒している方々には大いにオススメします。",positive,ストレス,その他,ホラー要素として「ストレス」と表現し、マゾヒスト向けと肯定的に評価しているため。
100,おすすめしない,1581,"kusoge-
mattigagomisugi",negative,kusoge,その他,「クソゲー」と表現しているため。
