番号,判定,総プレイ時間(時間),レビュー本文,AI感情判定(Ollama),具体的な要因,要因の分類,AIによる分析理由
1,おすすめ,908,iiii,negative,映画化,外部要因・映画化,映画化に関する不満を述べているため。
2,おすすめ,1889,沼,negative,沼,その他,「沼」という言葉から、ゲームプレイが苦痛で抜け出せない状態であると推測できるため。
3,おすすめ,195,fps下手でも立ち回り次第で勝てて楽しいです！！,positive,立ち回り,ゲームシステム,FPSが苦手でも立ち回りが重要である点が面白いと述べているため。
4,おすすめしない,3,ランチャーがくそ　馬鹿過ぎ　無料じゃなくて金よこせよ,negative,ランチャー,その他,ランチャーに対する不満からネガティブな感情を抱いているため。
5,おすすめ,293,mamaよき,positive,mama,その他,「mamaよき」という表現から、肯定的な感情が読み取れるため。
6,おすすめ,1024,"このゲーム面白いときはガチおもろいよ
おもんないときマジおもんないけど
でもおかげで情緒不安定にしてくれて凄い振り回されるから楽しいよ",positive,振り回される,その他,ゲームの面白さとつまらなさを交互に味わうことで、感情が不安定になることを「楽しい」と表現しているため。
7,おすすめしない,27,マッチングしなさすぎる,negative,マッチング,その他,ゲームとプレイヤーの好みが合っていないと感じているため。
8,おすすめしない,551,"中毒性50%
イライラ30%
快感20%",positive,中毒性,ゲームシステム,中毒性の高さから、ポジティブな感情が生まれているため。
9,おすすめしない,334,さようなら,negative,映画化,外部要因・映画化,映画化に関する不満を述べているため。
10,おすすめしない,130,f,negative,映画化,外部要因・映画化,映画化に関する不満が強く、ゲームそのものへの評価は低い。
11,おすすめしない,1230,ソロでも毎回フルパにぼこられるクソゲーなので、友達のいない寂しい人は大人しくアンインストールしましょう,negative,ボリューム不足,ボリューム・価格,ソロプレイでも毎回フルパに負けるという内容から、ゲームのボリュームが足りないことが不満として挙げられているため。
12,おすすめしない,0,"ランクマッチシステムがくそ。すべてを台無しにしている。ユーザーが減るのも納得のゲーム。
どのロールをやってもマッチがつまらないものになるくらいの悪いシステムを採用している。
チャット欄もトキシックしかいないあまりにもおすすめしないゲーム。
大会を見るくらいがちょうどよく、ソロでプレイするならストレスがたまり寿命がへるのを覚悟でやったほうがいいだろう（笑）",negative,ランクマッチシステム,ゲームシステム,マッチングの悪さとユーザーの態度がストレスを誘発するため。
13,おすすめしない,174,ランク調整が終わってます,neutral,ランク調整,その他,ランク調整が完了したことを伝えるだけの文章であるため。
14,おすすめ,154,ウーヤン、マーヤン…？,negative,映画化,外部要因・映画化,ゲームの内容ではなく、映画化に関する話題であるため。
15,おすすめしない,224,ナーフや強化が適切ではない。味方をキャリーしたところでいつの間にか死んでいる。面白くない。,negative,ナーフ・強化,ゲームシステム,バランス調整の不備がゲームプレイに不満をもたらしているため。
16,おすすめしない,42,これって、、、、,negative,不明瞭さ,その他,文章が「これって、、、、」としか書かれていないため、感情や要因を特定することができません。
17,おすすめしない,171,"まず治安が悪いです。非ランクでも他のFPSゲーのランクの２倍ぐらい暴言、nice DPS (皮肉)等がめちゃくちゃチャットで来ます。初心者だからとかじゃなく、初心者は来るなよって平気で言われます。対戦相手じゃなくずっと他のFPSとは違った意味で味方にストレスを感じます。正直楽しめないです。
次に良いところ、キャラ数が多くて最初から使えるので飽きはしないです。いろんなキャラを試せていいと思います。ただ前に記述したとうり、非ランクで好きなキャラ使いたくても戦犯すると味方からキャラ変えろ等暴言が飛んできます。
私だけかもしれませんがすごいストレスです。ただ試合前にいつも挨拶してると多少は暴言が減ったような気もします。
総評、ゲーム自体はかなり面白いと思います。新キャラがバランスブレイカーだったり、DPSに偏ってたりはしますが、ただ本当にプレイヤーがひどいと思います。フレンドさんとかとフルパで組めたら超楽しいです。",negative,暴言,外部要因・映画化,対戦相手からの過度な暴言がストレスになり、ゲームを楽しむことができないため。
18,おすすめ,645,tanosii,negative,映画化,外部要因・映画化,映画化に関する不満を述べているため。
19,おすすめしない,20,クイック最初の数試合連勝したら途端に格差マッチが始まり、レート解禁の50勝に到達することが困難になる。,negative,格差マッチ,ゲームシステム,格差マッチによりレート上昇が難しくなるため。
20,おすすめしない,2,ランクが壊れているの一言につきる。最高ランクプラチナ5プレイ時間70時間の人が次のシーズンマスターになったりするゲームです。このゲーム程運営の思った通りのマッチングシステムになっているゲームは存在しないでしょう。,negative,マッチングシステム,ゲームシステム,運営の意図したマッチングシステムだと作者が述べているため。
21,おすすめしない,179,シオンのエロあるよ（笑）,neutral,シオンのエロ,その他,ゲーム内容に関する感想ではなく、キャラクターの性的な描写に注目しているため。
22,おすすめしない,4,５０勝できなくてランクできません　SSDの無駄なのでアンインストールします,negative,ボリューム不足,ボリューム・価格,50勝できてランク付けできないという記述から、ゲームのボリュームが足りないと感じているため。
23,おすすめ,31,w,negative,組織の問題,外部要因・映画化,映画化や組織の問題に対する不満を述べているため。
24,おすすめしない,41,ごみ,negative,ごみ,その他,「ごみ」という表現から、ゲームに対するネガティブな感情が強いと判断したため。
25,おすすめしない,21,クイックでキレるようになったら辞め時,negative,ボリューム不足,ボリューム・価格,「クイックでキレるようになったら辞め時」という表現から、ゲームのボリュームが少なすぎることを示唆しているため。
26,おすすめしない,104,メモリが破壊されました,positive,精神が壊れる,その他,ホラーゲームとして「メモリが破壊された」という表現から、恐怖や精神的な影響を肯定的に受け止めているため。
27,おすすめ,12,おもしろいですよ,positive,おもしろい,その他,「おもしろいですよ」という表現から、ゲームを肯定的に評価しているため。
28,おすすめしない,33,冗談とか抜きでこのゲーム面白いと思う人いるんですか？正気か？,negative,面白さ,その他,作者はゲームが面白くないと感じているため。
29,おすすめしない,5,粘着しかいない人生における有限な時間を無駄にするのに持って来いのゲーム,negative,ボリューム不足,ボリューム・価格,「有限な時間」を無駄にするにふさわしいと皮肉った表現から、ボリュームが足りないことが推測されるため。
30,おすすめしない,269,OWから逃げました。,negative,OWからの逃亡,その他,ゲームをプレイしたくないほど嫌な体験だったことを示唆しているため。
31,おすすめしない,170,公式が勝率50%になるよう調整していると公言している最高のゲーム。,positive,勝率50%,ゲームシステム,公式が勝率50%になるように調整していると公言している点が、プレイヤーの心理を揺さぶる要素として評価されているため。
32,おすすめしない,5,gomi,negative,映画化,外部要因・映画化,映画化に関する不満を述べているため。
33,おすすめしない,115,goみ」,negative,映画化,外部要因・映画化,映画化に関する不満を述べているため。
34,おすすめしない,1347,OW2からOWに戻ってから頻繁にクラッシュするようになった。公式フォーラムに問い合わせても何の情報も得られず、クラッシュのせいで、BANされてしまいまともにプレイできなくなっている。,negative,クラッシュ,ゲームシステム,頻繁なクラッシュとサポート不足によりプレイ不能になっているため。
35,おすすめしない,1107,勝率調整やめろ,negative,勝率調整,ゲームシステム,勝率調整を批判しているため。
36,おすすめ,24,akasatana,positive,恐怖感,演出・グラフィック,ゲーム内の描写や音声が非常に怖く、精神を揺さぶられる体験ができたため。
37,おすすめしない,469,,neutral,データなし,その他,レビュー本文が空です。
38,おすすめ,378,面白い,positive,面白さ,その他,「面白い」と表現しているため。
39,おすすめ,330,自分のPCは決して性能がいいとは言えませんがそれでも144fps張り付きでサクサク動くのはすごいです。ゲーム自体も非常に面白くおすすめできます。ロールはタンク、ダメージ、サポートの3つがあり自分はサポート専なのでよかったですがダメージは人気なこともあり非常にマッチング時間が長いです。民度はレビューを見る限り散々に言われていますがチャットをミュートにするなど自衛もできます。,positive,サクサク動く,ゲームシステム,PC性能が良くなくても144fpsで動作する点が素晴らしいと述べているため。
40,おすすめしない,102,"アプデがクソみたいに遅い
私の環境のせいかもしれませんが、ssdに入れてるし他のゲームはここまで遅くないと思います
ゲームの内容は面白いと思います
アンランを除いて",negative,アプデ速度,外部要因・映画化,アプデが遅いことを批判しているため。
41,おすすめ,58,OWから逃げるな,negative,映画化,外部要因・映画化,ゲームの内容よりも、映画化に不満を述べているため。
42,おすすめしない,92,つまらないのでやめた方がいい,negative,ボリューム不足,ボリューム・価格,「つまらない」と表現し、プレイを中止したため。
43,おすすめしない,291,TANK GAP GG,negative,映画化,外部要因・映画化,ゲームの内容よりも、映画化に不満を述べているため。
44,おすすめしない,316,面白すぎてアンインストールしました！,negative,ボリューム不足,ボリューム・価格,短すぎるゲーム内容に不満を感じているため。
45,おすすめしない,711,本当に面白い奇跡の神ゲー,positive,神ゲー,その他,「奇跡の神ゲー」と表現しているため。
46,おすすめ,22,csで1500時間ほどプレイしました、まずこのゲームは負けると死にたくなるほど不快な気持ちになります、ですが勝ったときやキャリーした時は恐らくほとんどの人間が人生で感じる最大の快感を味わえます。ゲームを閉じるたびにもう二度とやらないと心に決めても数時間後もしくは数秒後にはにはモニターにOWと表示されています、低評価レビューをかいてる人もどうせ今もプレイしているでしょう。とにかく中毒性があり気づけば３年もやってました。,positive,中毒性,その他,負けると不快な気持ちになるが、勝った時の快感やゲームの引き込みやすさが中毒性を生み出すため。
47,おすすめ,85,このゲームを閉じたときに幸せな気持ちだったことほとんどない,negative,閉じたときの気持ち,その他,ゲームを終えた後の感情が「幸せ」ではなかったため。
48,おすすめ,1328,プレステの時からお世話になってる神ゲー、コレが無料で良いのかと思うほどのシューティングゲームです。もちろん課金要素はありますが、スキンに関するものばかりで、最近のありがちな課金したら強くなるだとか、某ゲームのようにキャラクターを解放するために、課金が必要なわけでもないです。私は、いつもありがとうの気持ちで課金させてもらってます。,positive,シューティングゲーム,ゲームシステム,レビュー者は「神ゲー」と表現し、シューティングゲームとしての質を高く評価しているため。
49,おすすめ,997,どのFPSよりも面白い,positive,面白さ,その他,「どのFPSよりも面白い」と表現しているため。
50,おすすめ,260,kamige-,positive,恐怖感,演出・グラフィック,ゲーム内の描写や音声が非常に怖く、精神を揺さぶられる体験ができたため。
51,おすすめしない,829,マッチング遅すぎんねんしばくぞ,negative,マッチング遅すぎ,ゲームシステム,マッチングが遅いという点で不満を述べているため。
52,おすすめ,91,いい,negative,映画化,外部要因・映画化,映画化に関する不満を述べているため。
53,おすすめしない,208,"シオン追加アップデートに伴ってクラッシュ頻度が２試合に一回まで増えた。以前のバージョンでは一度も落ちていなく、ゲーム内設定はプリセットで低にしているHDR は不使用。
ライバルマッチのクラッシュで合計８時間ban記念レビュー。
また公式サポートは問い合わせがそもそもできない設計になっているため泣き寝入りするしかない。
このゲームはやる価値がない。",negative,クラッシュ頻度,ゲームシステム,アップデートによるクラッシュ頻度の増加と公式サポートの非対応が挙げられているため。
54,おすすめ,360,最高なゲーム,positive,最高,その他,「最高なゲーム」と表現しているため。
55,おすすめしない,0,勝てない,negative,勝てない,ゲームシステム,ゲームが難しすぎて勝てないと述べているため。
56,おすすめ,54,おもしろい,positive,おもしろい,その他,「おもしろい」と評価しているため。
57,おすすめしない,180,ホラゲー,negative,ボリューム不足,ボリューム・価格,短すぎるゲーム内容に不満を述べているため。
58,おすすめしない,1175,気持ちが冷めるポイントが非常に多く散りばめられたゲーム。,negative,気持ちの冷めるポイント,その他,多くの「気持ちの冷めるポイント」が挙げられているため。
59,おすすめしない,189,なぜかすごくみんな怒っている,negative,みんな怒っている,外部要因・映画化,ゲームの内容ではなく、周りの反応がネガティブであるため。
60,おすすめしない,88,こんなゲームしてる暇あったら田植えしてろもいらみてえに,negative,ボリューム不足,ボリューム・価格,「こんなゲームしてる暇あったら田植えしてろ」という表現から、ボリュームが少なすぎることを皮肉っているため。
61,おすすめ,133,"シンプルに面白い。今までやってきたFPSの中で一番純粋な面白さ。
エイムアシストを恐れることなく、キーマウで充実したゲーム体験ができる。
互いにHPが多く駆け引きが生まれ、エイムする楽しさ･攻撃する楽しさもたっぷり感じる事ができる。
他の要素についても比較的バランス良くできていると思われ、とにかくFPSとしての完成度が高い。",positive,エイムアシスト,ゲームシステム,エイムアシストを恐れることなくプレイできる点が評価されているため。
62,おすすめ,13,くそおもろい,positive,くそおもろい,その他,「くそおもろい」という表現から、ゲームを非常に面白いと感じていることがわかるため。
63,おすすめ,459,.,positive,恐怖演出,演出・グラフィック,ゲーム内の描写や音声が非常に怖く、精神を揺さぶられる体験ができたため。
64,おすすめしない,72,Kiriko > Mercy + Moira,negative,バランス調整,ゲームシステム,KirikoがMercyとMoiraを上回る性能を持っているため。
65,おすすめ,10,"あまりにも評価が低いのでおすすめでレビューしておきます
battlenetの方で800時間ほどプレイ(ランクは緑です)
仮にも対戦FPSで数少ないGame of the Yearを受賞してるゲームが面白くないはずありません。
[b]一度はプレイしてみてほしい。このゲームは他には絶対に味わえない何かがあります[/b]
ただ、他の人が言っているようにチャットは必ずOFFにしましょう(多分今はデフォルトなのかな？)。
運営もいいとも言えませんがどっかの鬼ごっこゲームとかと比べるとずいぶんマシなので...


[h3]ランクマッチについて[/h3]
楽しく遊ぶならやらなくていいです。このクイックはこのゲームの楽しいところだけを楽しめます。

ランクマッチは(ランク上の)同じ実力の人と対戦できるモードです。[u]ランクを上げるのはおまけ[/u]
まぁ上は建前なので本題を(メンタルを保つには大事)

このゲームはMOBAとFPSの組み合わせと言われる通りとてもチームの連携が重要です、なのでソロで回すと負けたときの原因探しの結果が味方になりがちです。(私はもうそうは思わなくなった)
そのためチームメイトに暴言を吐いたりする人が一定数居ます(日本人として悲しいね)
ランクマッチを楽しく遊ぶには
[list]
 [*]パーティで遊ぶ
 [*][b]絶対に他責せず負けた原因はすべて自責する[/b]
 [*]何も考えずに遊ぶ
 [*]勝ち続ける
[/list]
これらのどれかになると思います。(私は2の人だったけど少数なんだろうなぁ)
これを踏まえると、
上達したい、報酬が欲しい、自分と同じレベル帯の人と遊びたい等の理由がなければこのゲームのランクマッチは遊ぶ意味がないと思います。
[h1]要するにこのゲームはめちゃくちゃ面白くて白熱する！
だ　か　ら　負けるとイライラする！[/h1]",positive,白熱感,その他,ゲームの白熱感が作者を惹きつけ、負けることへのイライラの感情も表現しているため。
66,おすすめしない,137,楽しくない,negative,楽しくない,その他,文章全体から「楽しくない」というネガティブな感情が表現されているため。
67,おすすめ,892,かみげー,negative,ボリューム不足,ボリューム・価格,「かみげー」という短い感想から、ゲームの内容に満足していないことが推測できるため。
68,おすすめしない,325,"とにかくマッチ格差がひどい
民度とかそんなのどうでもいいくらいです",negative,マッチ格差,ゲームシステム,プレイヤー間の能力差が大きく、ゲーム体験を損なっているため。
69,おすすめしない,2695,"ロールキュー、オープンキューのマッチングシステムが壊れてます。
せめてスタジアムのランクシステムにして欲しいです。",negative,マッチングシステム,ゲームシステム,マッチングシステムのバグに不満を述べているため。
70,おすすめ,252,"暴言、肢体撃ち、楽しい！！！！！！！！！！！！！！！！！
どのfpsゲームももっと民度悪くなってfpsというゲームは新規お断りにしよう！！！！！！！！！！！！！！！！！！！！！！",positive,民度悪さ,その他,暴言、肢体撃ちを楽しむ様子から、ホラー要素ではなくゲーム性そのものを肯定的に評価しているため。
71,おすすめ,440,心臓を捧げよ,positive,恐怖演出,演出・グラフィック,ゲーム内の描写や音声が非常に怖く、精神的に揺さぶられる体験ができるため。
72,おすすめ,140,嫌いになりそう,negative,ボリューム不足,ボリューム・価格,「嫌いになりそう」という表現から、ゲームの内容に満足していないことが推測できるため。
73,おすすめ,68,hizyouniomosiroi,negative,映画化,外部要因・映画化,映画化に期待していたが、組織の問題でゲームの内容と関係ない不満を述べているため。
74,おすすめ,65,このゲームはとてもイライラします。ありえんぐらいイライラします。面白くはあるのですがやっぱりイライラします。イライラに耐えられるならばインストールしましょう。,positive,イライラ,ゲームシステム,レビューでは「イライラする」と表現しながらも、「面白くはある」と肯定的な要素も述べているため。
75,おすすめ,72,omoroi,negative,映画化,外部要因・映画化,映画化に期待していたが、ゲームの内容と全く関係ないため不満である。
76,おすすめしない,317,パチンコ,negative,パチンコ,その他,ゲームの内容がパチンコと表現されているため。
77,おすすめしない,139,いろんな意味で時間を無駄にします,negative,時間の無駄,ボリューム・価格,「いろんな意味で時間を無駄にする」という表現から、ゲームの内容に満足していないため。
78,おすすめ,1962,battlenet版より軽量なのか最適化されているからなのかわかりませんがfpsが安定してでるのでSteam版、おすすめです。,positive,fps安定,ゲームシステム,FPSが安定しているためおすすめと述べている。
79,おすすめ,9,KANNOKEHAZAMA,positive,恐怖演出,演出・グラフィック,ゲーム内の描写や音声が非常に怖く、精神を揺さぶられる体験ができるため。
80,おすすめ,322,☻,negative,映画化,外部要因・映画化,映画化に関する不満を述べているため。
81,おすすめ,636,ひかきん,positive,恐怖演出,演出・グラフィック,ゲーム内の描写や音声が非常に怖く、精神を揺さぶられる体験ができるため。
82,おすすめしない,1250,"マスター３からプラチナへ降格！！
明らかに味方のせいで負けてる試合のほうが多いです。
友達を作り友達とやりましょう",negative,味方のせいで負ける,ゲームシステム,味方のプレイに不満があり、負けが続いているため。
83,おすすめしない,435,レートおかしいし味方弱すぎるし勝てないしパーティー組まないとごみげーです,negative,味方弱すぎる,ゲームシステム,味方の性能が低いと感じるため。
84,おすすめ,433,おもんない,negative,ボリューム不足,ボリューム・価格,「おもんない」という表現から、ゲームの内容に満足していないため。
85,おすすめ,1380,最高,positive,最高,その他,「最高」という表現から、ゲームに対する肯定的な感情が強いと判断したため。
