番号,判定,総プレイ時間(時間),レビュー本文,AI感情判定(Ollama),具体的な要因,要因の分類,AIによる分析理由
1,おすすめ,39,"A very well-made action game that was ruined by its title. The criticism that ""this isn't Sacred"" doesn't review the enjoyment of the game itself at all. It's probably time to set aside the fact that this is Sacred and just enjoy it as an action game.",positive,ゲームの楽しさ,その他,レビュー者はタイトルの問題点を指摘しつつも、ゲームそのものを楽しめる点に重点を置いているため。
2,おすすめ,1,"セイクリッド2とは似ても似つかない作品です。
２はオープンワールド。３は一本道の面クリゲームかな。
２は移動がけっこうしんどく、来年(2026)出る予定のリマスターではファストトラベルあたりを何とかしてほしい。
３はどんどん敵を倒しながら先へ進みミッション毎のボスを倒すことがゴール。
宝物から武器、防具は出ないのでハクスラって感じはないですね。
別ゲーなのでどんどん敵を倒してサクサク進めたい方にはお勧めかも。
２は雑魚敵が多すぎて先に進めない（多すぎて）ので本作は軽く遊びたい人にはお勧め。
１ミッションも短いし。
でもマルチできるみたいだが、どうやって呼ぶんだ？",positive,サクサク進められる,ゲームシステム,敵を倒しながらどんどん先に進めるシステムが軽くて遊びやすいと感じているため。
3,おすすめしない,5,"Sacredシリーズ未プレイです
湧いてくる敵を全滅させて先に進むを一生繰り返すゲーム
ゲームが単調すぎて無双ゲーとしてもあまり楽しめません
成長要素もこういうゲームにしては少なめに感じます",negative,単調さ,ゲームシステム,敵を全滅させて先に進むだけの繰り返しで、飽きやすく無双ゲーとしても楽しめないため。
4,おすすめしない,5,Torchlight2で良かったです。,positive,Torchlight2,その他,他のゲームとの比較から好印象を抱いているため。
5,おすすめ,19,"本作が初めてのプレイですが、とても楽しくプレイさせて頂いています。

セールの時に購入すれば、安く手に入るし、とても綺麗なグラフィックです。
挿入されるムービーも長くはないし、一回の冒険の時間が短いので、忙しくて時間があまり取れない方にもオススメ出来ます。

ただ、探索要素（武器・装備集め）なし、複雑なアクションもないので、アクションは苦手だと言う方も入りやすいと思いました。",positive,シンプルなゲーム性,ゲームシステム,探索要素や複雑なアクションがないため、アクションが苦手な人でも楽しめると思ったから。
6,おすすめ,19,"ユーザーが設定したタグにあるように、文字通りのハック＆スラッシュです。
前作にあったトレハン要素が皆無なのでそこに期待すると肩透かしを食らいます。
前作までシリーズを制作していた会社が倒産し、結果別会社が作った作品ですのでコンセプトも違うのかと思います。

限りある回復手段でギリギリ勝てるというのを面白いと思うかどうかは
その人次第ですが、ハクスラとしては十分楽しめます。

マルチに関してですが、私の場合近隣の大陸の方々とご一緒することが多くて
プレイスタイルの違いなのでしょう協力するという姿勢が感じられず、「共闘」の楽しさはまだ実感でいていません。
敵がわらわら押し寄せるタイプのゲームですので、
国内ユーザーや早くからネット環境が整っていた米国の方たちとマッチすれば
より楽しめるのではないかと思っていますが、なかなかどうして・・・・。",positive,ハクスラ要素,ゲームシステム,ハクスラの要素を楽しめるため。
7,おすすめ,19,"「ハック&スラッシュアクションゲーム + RPG」
▪物語
ゼーンという侵略者がいるため打倒の旅に出る。

▪クリア時間
難易度レジェンド(ハード)で6時間程、ＤＬＣ及び難易度ゴッド(ベリーハード)を足せば10時間程

▪ゲーム内容
・「ワイルドアームズ４」のようなボードマップに点在する各ステージをクリアしていくことで、所持できる消費アイテムや防具のレベル、及びキャラクタースキルの構築を固めていくことが出来る。
・装着できるアーツスキル(必殺技)は、二つに種別された中から一つずつ選択することが出来る。
・ステージを始める前に回避か防御かを選択することができるので、プレイスタイルをプレイヤーに合わせることが可能。
・レベルでスキルを解除させて、お金で購入という流れでプレイヤーを強くさせることが出来る。
・「ウェーブ毎に登場する敵を撃破する」、「オブジェクトギミックを一定数作動させる」という決まったイベントしか存在しない。
・難易度レジェンドでもノーマルに近い難易度で、ゴッドからはアクションゲーム化する(ある意味こちらが本番)。

▪個人的な感想
セイクリッド２がオープンワールドハクスラだったということでセイクリッド3の変わりように困惑されている方を沢山見受けられるのですが、個人的には少なからずこのセイクリッド３での方向性は間違っていなかったと思います。同じような作品でダンジョンシージ３を思い出しました。
今や数えきれないほどハクスラ作品が開発されております。その上ディアブロやグリムドーンなど、このジャンルの王に相応しき存在が牛耳っております。これからも開拓し続ける其々の王が圧倒的なのはすでに目に見えていることで、中途半端な作品は過去のものとなるでしょう。そんな現状で同じようなものを作ってしまえば罵られることは分かっていることです。
そもそも私が初めてプレイしたハクスラがセイクリッド1と2だったのですが、イマイチ印象に残らなかったので絶賛されていたのかと驚きました。個人的には「スキルポイントの再割り振りができない」、「プレイの仕方によってはメインクエストそっちのけになる」、「開拓しても変化のない世界の形」等、途方に暮れたプレイ感覚に果ててしまった記憶しかありません。
なので、今作でこうなるだろうと納得してしまいました。
何はともあれ人を選ぶ作品だとおもいます。セイクリッド２もそうでしたが、３の場合レベル上げをすると難易度レジェンドでは簡単すぎます。DLCや難易度ゴッドはプレイヤーと敵のレベルが同一化するので、DLCステージの一つをプレイすると1レベル上がるようなペースになります。一週目は難易度レジェンドでレベル上げをせず楽しむことにして、難易度ゴッドからレベル上げとスキルの構築を平行して進めていく方が良いかと思います。

▪良い点
「アクションゲーム」として楽しむことをお勧めします。ダンジョンシージ3もプレイしましたが、この作品の良かった点に「攻撃と防御or回避がスムーズであること」や「スキルの効果が感じ取れやすい」などがあります。攻撃をしながら回避をすることで、スキルによっては完全防御、90%ダメージ耐性などプレイヤースキルに応じた効果が発揮されたので楽しかったです。技を強くすることで直接効果を感じとれることもあり、そういった点はダンジョンシージ3より楽しめられました。
他にキャラクターごとの能力がハッキリしている点も良いです。
協力プレイは、回復用の陣が張れたり、仲間を援護するスキルが活用できたりと楽しかったです。
オンラインは二人となら普通に楽しめられました。プレイヤースキルを然程要求されないので良いですね。

▪気になった点
難点は「おちゃらけた物語」と「単調なステージギミック」、「スキルツリーによる能力開拓の方向性が皆無」であること。
おちゃらけた物語に関しては、ベースとなるバックストーリーがそっちのけになっている上、ダンジョンシージ3の会話選択のような”物語を楽しむ要素”もなく酷い有様でした。特にバーバリアンのセリフの意味分からなさ、もう開発のやる気が反映されているのかと感じました。
ステージギミックはまだしも、能力の成長パターンは分けてほしかった。分かりやすいのに勿体無い、ハクスラ初心者は楽しめられたはずなのに。
敵の攻撃パターンが一部同じであることも気になりました。

▪結論
シンプルなゲーム内容とか通り越して、こじんまりし過ぎる内容に値段が安かったこともあり満足はしているものの、フレと楽しむくらいでないと薄っぺらすぎる。PS3版で400円、Steamで300円、この値段なら十分すぎるぐらいかという感じです。
これダウンロードゲームなら値段相応になるんですよ。今ならダウンロードゲームより遥かに安いです(セールや鍵屋)。
個人的には十分楽しめられたのでお勧めにしておきましたが、人を選ぶ作品です。トップダウンアクションゲームも少なくなってきているので貴重ではありますが、もう少し練りこんだら良い作品になっていたかもしれません。凡作に毛が生えた程度でした。",positive,攻撃と防御or回避がスムーズであること,ゲームシステム,レビューでは、攻撃と防御や回避の操作がスムーズで、スキルを使うと効果を感じやすい点を挙げている。
8,おすすめしない,1,見下ろし型の無双ゲー。正直つまらない。爽快感が無く、あまり技量も必要ではなく、シナリオも陳腐。,negative,シナリオ,その他,シナリオが陳腐だと述べているため。
9,おすすめしない,12,"Co-opにてプレイ
見下ろし方無双ゲー
何も考えない脳死ゲー^q^",positive,脳死ゲー,ゲームシステム,「何も考えない脳死ゲー」と表現しており、ポジティブな意味で使われているため。
10,おすすめしない,50,"※50時間のプレイ記録があるが、これは不正落ちした挙句、タスクに残っていやがったせいで、
実際には一周10時間も掛からないペラペラゲー。

トレハン要素が皆無のハクスラ。

自分は過去作をプレイしたことはないが、この3は過去作とゲーム性がガラリと変貌し酷評を喰らっていることは知っていた。

が、ここまで酷い出来だとは思っておらず、想像を遥かに超える糞ゲーだったというのが率直な感想。

トレハンの要素は本当にゼロ。ドロップするのはコインと回復アイテムのみ。ボスや宝箱から気前のいいハクスラのごとく、それらが大量にドロップするのが逆に腹が立つ。

じゃあ、コインで武器や防具を買えるんじゃないのと思うかもしれないが、そうした要素も無し。防具は無しで、武器は序盤に手に入れる三種のみ。

成長要素も極めて乏しく、武器やスキルに申し訳無さ程度に成長ツリーが用意されている程度。この成長にコインを使う。が、余りまくるのでコインの存在意義も不明。

アクションは通常攻撃と装備した二種の範囲スキルを連打するだけ。HPやMP回復アイテムが出まくるので緊張感が全くない。回避もあるが、キー＆マウス操作だとWASD移動にも拘わらずポインタの方向に転がるという糞仕様で操作性までもが台無し。

ステージこそ初見では沢山あるように見えるが、まともなステージは大きなマス目のみで、小さいマス目はあっという間に終わるただのボーナスステージという手抜き。

ステージ構成も少し進む度に通行止めの発生＋敵の殲滅を強制され、これを延々繰り返す。挙句中盤以降から即死トラップが登場し、終盤は連チャントラップでストレスフル。

ステージ進行中にNPCがやたらと喋るのだが、ゲームのペラさを誤魔化すためだと思うと、本来嬉しいはずの演出がこれまた逆に癇に障る始末。

トレハン要素ゼロで退屈アクションという救いようのない絶望的ハクスラ。例えワンコインのセール価格であっても、このゲームは絶対にお薦めできない。",negative,トレハン要素ゼロ,ゲームシステム,レビューでは、トレハン要素が全くなく退屈だと述べているため。
11,おすすめ,13,"吉野家で食事するごとにもらえるクーポン3枚集めたら380円割引になりまして、、そんな時このゲームが370円で売っていたので浮いた食費で購入。
他の方のレビューを見てスマホゲームっぽいは言い過ぎだろって思ってたけど、良くも悪くもスマホのダーククエスト5（Dungeon Hunter 5）と同じような感じでした。
データ容量は17GBほどあるのでグラフィックはかなり綺麗です。しかし15分ほどでクリアできるメインミッションが15個しかないので下手すると無料スマホゲームの方が長く遊べる気がします。フルプライスで買った方はほんと怒りを感じただろうなと思います。開発者の方には悪いけど370円は妥当だと思いました。
とにかく吉野家には感謝しきりです。おすすめは豚チーズ丼とごぼうサラダです。",negative,ボリューム不足,ボリューム・価格,メインミッションが短く、無料スマホゲームの方が長く遊べる可能性があるため。
12,おすすめしない,24,"残念ながらハクスラではないです。
しかしながら、緊急回避をして攻撃をうまく避けたり、ガードをして攻撃を受け止めたり。
溜め攻撃で相手の攻撃モーションをキャンセルさせたり。
つかみで敵を投げ飛ばしたり。
アクションゲームとしてはそこそこやり応えはあるように感じます。

しかし「ブロック」スキルを得た後のなんとも言えなさと言えば…。
このスキルは最初は「被ダメージを90%軽減」という効果しかついていないのですが、
レベル制限の開放により「被ダメージの3倍を敵に与える」という効果を付与することができます。
どういうことかと言うと、ボスの攻撃を回復アイテムを使いながらひたすら耐えているだけでボスが死ぬようになります。どうしてこんなむごいことを
使いたくなければ被ダメージ3倍返しの代わりに「ブロックでダメージを受けたときに生成されるエネルギー50%増加」を取ればいいのですけどね。それか回避スキルを使うか…。

1人でやるには少し物足りないですが、coopでわちゃわちゃするには良いゲームではないでしょうか。",positive,アクションのやり応え,ゲームシステム,緊急回避やガード、溜め攻撃など、敵を避けたり攻撃を受け止めたりするアクションがやり応えがあると感じているため。
13,おすすめしない,25,"Sacred2をプレイして楽しみにしてたんですが…酷評の通りRPG要素のあるアクションゲームでした。
せめて、武器だけでも落としてくれるシステムであれば良かったのですが（実際はお金やライフ回復するアイテム等のみ）凹",negative,武器ドロップ,ゲームシステム,武器を落とさないシステムが期待外れだったため。
14,おすすめ,19,X360コントローラーでやったらDIABLOⅡみたいで面白かった。,positive,DIABLOⅡ,ゲームシステム,DIABLOⅡのようなゲームシステムが面白く感じたため。
15,おすすめ,3,"自分はSACREDシリーズは3が初になります。
細かいゲーム内容のレビューは既に他の方が投稿しておりますのでそちらを参考してください。

私はプレイして一番気になった点を書かせていただきます。
それはプレイするにあたってはコントローラーを使用した方がいいということです。

何故ならキーボード＋マウスの操作ですと、攻撃する方向(何らかのアクション全てっぽいです)は
キャラの方向ではなく今置いてあるマウスカーソルの方向になるからです。

実際に私は弓キャラを使用しておりますが、攻撃する方向にマウスカーソルを置いて攻撃していて
敵が突進してきたときに緊急回避したときにマウスカーソルが敵の方向に置いたままだったので
敵に突っ込んでしまうことが何度もありました。

以上のことからプレイする際にはコントローラーでの操作をオススメさせていただきます。

ゲーム自体は非常に面白いと思います。
セールで安くなりますのでフレンドの分まで購入してCOOPをしてみるといいかもです。",positive,ゲームシステム,ゲームシステム,キーボード＋マウス操作での攻撃方向がキャラの方向ではなくカーソルの方向になるため、緊急回避時に敵に突っ込んでしまうことがある。
16,おすすめしない,26,"[h1]個人的には好きだけど、とても他人（ひと）にはオススメ出来ないタイプのゲーム。[/h1]
一通りクリアしてみたが色々となんとも素っ気なく深みがない感じ。
コントローラー対応のハクスラ『R.A.W. Realms of Ancient War』を思い出すプレイ感。
ボードゲームのような地図にメインクエストの要所があり、他に要所と要所の間に回復ポーション等のストックを増やせるサブミッションステージが有る。サブミッションもそんなに広くないステージでWAVE戦とエリア内の敵を殲滅しか無い。面クリタイプのハクスラなのでこじんまりした印象があり、合わない人には合わないかも。良く言えば作業的に進めれば必ずクリアは出来る。
一応の前作『セイクリッド2』の続きではなく、後に出たベルトスクロールアクションのスピンオフ 『セイクリッドCitadel』の世界観を引き継いでいる感じ。
ハクスラゲーの醍醐味であるアイテム掘りでボスを周回する等のレアリティ概念はなく、経験値を貯めると武器レベルが上がり自動的に使える武器が開放されるシステムなので、やりこみ要素もレベル上げとアビリティのスキル振り分け程度でゲームそのものの底はとても浅い。
オンライン協力プレイも出来るがゴムバンド現象（ちょっとキャラを動かしてもすぐ元に位置に戻っちゃう）が非常に！非常に！多いので快適にプレイ出来るとは思えなかった。
セイクリッド3GOLD（DLC全部入り）だとサウンドトラックが付属しており
（場所はSteam\steamapps\common\Sacred 3のSoundtrack）
音楽自体の完成度はなかなか良い。
セールで1000円以下でもまだ…高いような気もする。 正統派ハクスラをやりたいならいわゆる神ゲーと呼ばれるTitan Questやトーチライトシリーズなど名作がセールで安くなっているのでプレイして頂いて、まだ物足りないならこのゲームをプレイするのもいいんじゃないでしょうか？",negative,ボリューム不足,ボリューム・価格,レビューでは「こじんまりした印象」や「やりこみ要素もレベル上げとアビリティのスキル振り分け程度」と、ゲーム内容が浅い点を指摘しているため。
17,おすすめ,6,"Sacredではありません。繰り返します。Sacredではありません。
ですが、面クリア型のアクションゲームとして見た場合、中々に面白い作品に仕上がっています。
勿論、１００点満点の秀作ではありませんが、
普通にCOOPやソロで遊ぶ分なら申し分ない面白さです。
キャラの育成も、思っていた以上に細かく出来ますし、
それなりにストーリーもちゃんとあります。
まぁ。おまけ程度ですが。
アクションゲームが好きな人や、兎に角ひたすら敵を倒すことに飽きない人へオススメします。",positive,アクション要素,ゲームシステム,アクションゲームとしての面白さとキャラ育成の深さが挙げられているため。
18,おすすめしない,20,"常に連打したい人におすすめ
サポート精霊を吸血鬼にすると野太い女の声で「おやっさーん！」とたまに叫びます",positive,サポート精霊の声,演出・グラフィック,独特な声の表現が面白いと感じているため。
19,おすすめ,27,"やあ、全国800万人のシューティングゲームファンの猛者たち！こんばんわ！
昨夜俺のファッキンなブラザーと一緒に難易度レジェンドをクリアしたから軽くレビューしてみるよ！

まず、このゲームはどこかで見たことのある風景やどこかでみたようなギミックなどが織りなす全く新しいガントレットのような格闘アクションゲームだ！そこらのDI＠BLOクローン的なものと一緒にしちゃいけない！
課金キャラを含む5人のヒーローの中から一人選んで様々なコンパットアーツと様々なウェポンスピリットと3種類の武器で難易度の向こう側を目指すんだ！
防御行動に防御と回避があるんだが、残念！こいつはどちらかしか選べないんだ！
組むビルドもかなり影響受けるから慎重に選ぼう！

最後に難易度にはレジェンドの上になんとゴッドというものが存在していて、レジェンドをクリアすることで挑戦出来るんだ！
俺たちはクリアした勢いそのままに神の領域に不用意に突っ込んだよ。

ちょっと笑えなかったぜ！

sacred2でゴールドからプラチナの世界に足を踏み入れたあの感覚だ！
だが、既にガントレットやダブルドラゴンなどをやり込んでいるような猛者は難易度レジェンドで始めることをオススメする。

おっと、忘れていた。このゲームをやるにあたって周りに一緒にプレイしてくれる素敵なブラザ－を1人以上用意しておくんだ！
誰も居ないのなら俺や誰かの部屋に入って適当に荒してくれてかまわないぜ！（キックしないとは言ってない）

ステージクリア後の何とも言えないキャラ絵達が気にならなくなったら君も立派なガチ勢だ！戦場で会おう！
　　　　　　　　　　　　　　　　　　　　　　　　　　　　　　　　　　　　　　　　　　　2015.9.12　CAPTAINーYOSI",positive,難易度レジェンドのクリア感,ゲームシステム,レジェンドをクリアした勢いそのままにゴッドに挑戦し、sacred2でゴールドからプラチナの世界に足を踏み入れたあの感覚を得たため。
